"video_id","url","video_title","speech_title","speaker_name","duration","duration_in_seconds","view_count","published_date"
"jfqwHT3u1-8","https://www.youtube.com/watch?v=jfqwHT3u1-8","Don Tapscott: Four principles for the open world","Four principles for the open world","Don Tapscott","17:51",1071,118412,"2012-06-28"
"jggHw5PdQV0","https://www.youtube.com/watch?v=jggHw5PdQV0","How young Africans found a voice on Twitter | Siyanda Mohutsiwa","How young Africans found a voice on Twitter","Siyanda Mohutsiwa","14:23",863,103843,"2016-04-15"
"jguSkEMwrcc","https://www.youtube.com/watch?v=jguSkEMwrcc","Nick Veasey: Exposing the invisible","Exposing the invisible","Nick Veasey","15:51",951,57243,"2010-01-05"
"jiDQDLnEXdA","https://www.youtube.com/watch?v=jiDQDLnEXdA","Why the best hire might not have the perfect resume | Regina Hartley","Why the best hire might not have the perfect resume","Regina Hartley","10:32",632,846790,"2015-12-21"
"jiUKpX09zo4","https://www.youtube.com/watch?v=jiUKpX09zo4","How state budgets are breaking US schools | Bill Gates","How state budgets are breaking US schools","Bill Gates","10:47",647,170914,"2011-03-05"
"jjyghcrVoRo","https://www.youtube.com/watch?v=jjyghcrVoRo","The Humans at the Center of the US Immigration Debate | Ali Noorani | TED","The Humans at the Center of the US Immigration Debate","Ali Noorani","12:04",724,32800,"2022-08-18"
"jk6Y3f2c4-I","https://www.youtube.com/watch?v=jk6Y3f2c4-I","How to have a healthier, positive relationship with sex | Tiffany Kagure Mugo and Siphumeze Khundayi","How to have a healthier, positive relationship with sex","Tiffany Kagure Mugo and Siphumeze Khundayi","11:38",698,106429,"2018-03-15"
"jlhtTKPkg5M","https://www.youtube.com/watch?v=jlhtTKPkg5M","Let's get honest about our money problems | Tammy Lally","Let's get honest about our money problems","Tammy Lally","12:31",751,160429,"2018-09-21"
"jltYcaQ24q4","https://www.youtube.com/watch?v=jltYcaQ24q4","Reducing corruption takes a specific kind of investment | Efosa Ojomo","Reducing corruption takes a specific kind of investment","Efosa Ojomo","11:46",706,48655,"2019-10-28"
"jmQWOPDqxWA","https://www.youtube.com/watch?v=jmQWOPDqxWA","How the pandemic will shape the near future | Bill Gates","How the pandemic will shape the near future","Bill Gates","43:08",2588,1850259,"2020-07-06"
"jn0Ygp7pMbA","https://www.youtube.com/watch?v=jn0Ygp7pMbA","Why dieting doesn't usually work | Sandra Aamodt","Why dieting doesn't usually work","Sandra Aamodt","12:43",763,723668,"2014-01-08"
"jr5mTwfFh00","https://www.youtube.com/watch?v=jr5mTwfFh00","How doctors can help low-income patients (and still make a profit) | P.J. Parmar","How doctors can help low-income patients (and still make a profit)","P.J. Parmar","10:22",622,57674,"2019-02-27"
"jsFAFsx9otw","https://www.youtube.com/watch?v=jsFAFsx9otw","Why Entrepreneurship Flourishes in The Countryside | Xiaowei R. Wang | TED","Why Entrepreneurship Flourishes in The Countryside","Xiaowei R. Wang","8:16",496,41733,"2022-04-13"
"jsyuyQ1bel0","https://www.youtube.com/watch?v=jsyuyQ1bel0","TEDTalks: Joshua Prince-Ramus (2006)","Joshua Prince-Ramus (2006)","TEDTalks","20:44",1244,18821,"2007-01-16"
"jtVIDBs60S8","https://www.youtube.com/watch?v=jtVIDBs60S8","Free yourself from your filter bubbles | Joan Blades and John Gable","Free yourself from your filter bubbles","Joan Blades and John Gable","9:19",559,116602,"2018-01-12"
"jx4q82a6jHc","https://www.youtube.com/watch?v=jx4q82a6jHc","The Otters of Singapore — and Other Unexpected Wildlife Thriving in Cities | Philip Johns | TED","The Otters of Singapore — and Other Unexpected Wildlife Thriving in Cities","Philip Johns","13:57",837,59628,"2024-09-26"
"jxKUDXrtDFI","https://www.youtube.com/watch?v=jxKUDXrtDFI","Thomas Hellum: The world's most boring television ... and why it's hilariously addictive","The world's most boring television ... and why it's hilariously addictive","Thomas Hellum","18:11",1091,276281,"2014-12-10"
"jxy4j0OndPM","https://www.youtube.com/watch?v=jxy4j0OndPM","Can Global Food Companies Make the Shift to Regenerative Agriculture? | Steve Presley | TED","Can Global Food Companies Make the Shift to Regenerative Agriculture?","Steve Presley","10:54",654,39334,"2023-07-27"
"jyYjI7zQlaA","https://www.youtube.com/watch?v=jyYjI7zQlaA","Majora Carter: 3 stories of local eco-entrepreneurship","3 stories of local eco-entrepreneurship","Majora Carter","18:30",1110,38875,"2011-01-03"
"jzfV2xVsUKc","https://www.youtube.com/watch?v=jzfV2xVsUKc","Why Public Beheadings Get Millions of Views | Frances Larson | TED Talks","Why Public Beheadings Get Millions of Views","Frances Larson","15:58",958,88641,"2015-10-13"
"jzrcRcEBrmA","https://www.youtube.com/watch?v=jzrcRcEBrmA","The transformative power of video games | Herman Narula","The transformative power of video games","Herman Narula","12:01",721,104689,"2019-10-31"
"k-duWafgHsY","https://www.youtube.com/watch?v=k-duWafgHsY","Katie McGinty: Smart solutions to decarbonize buildings | In the Green","Katie McGinty: Smart solutions to decarbonize buildings","In the Green","3:51",231,77281,"2022-01-31"
"k0Fx6igxRv8","https://www.youtube.com/watch?v=k0Fx6igxRv8","War in Ukraine -- and What It Means for the World Order | Ian Bremmer | TED","War in Ukraine -- and What It Means for the World Order","Ian Bremmer","49:13",2953,1667787,"2022-03-11"
"k0GQSJrpVhM","https://www.youtube.com/watch?v=k0GQSJrpVhM","How to fix a broken heart | Guy Winch | TED","How to fix a broken heart","Guy Winch","12:26",746,11026968,"2018-02-27"
"k12j-E1LsUU","https://www.youtube.com/watch?v=k12j-E1LsUU","3 ways to be a better ally in the workplace | Melinda Epler","3 ways to be a better ally in the workplace","Melinda Epler","9:38",578,240101,"2018-10-25"
"k1oPVp63eNk","https://www.youtube.com/watch?v=k1oPVp63eNk","The state of the climate crisis | Climate Action Tracker","The state of the climate crisis","Climate Action Tracker","4:44",284,219152,"2020-10-29"
"k2hQL9Zrokk","https://www.youtube.com/watch?v=k2hQL9Zrokk","Janine di Giovanni: What I saw in the war","What I saw in the war","Janine di Giovanni","11:54",714,72866,"2013-01-22"
"k3clwllhdlg","https://www.youtube.com/watch?v=k3clwllhdlg","I stepped out of grief -- by dancing with fire | Danielle Torley","I stepped out of grief -- by dancing with fire","Danielle Torley","13:03",783,44451,"2020-11-27"
"k3zZVQPaKKQ","https://www.youtube.com/watch?v=k3zZVQPaKKQ","Philippe Petit: The journey across the high wire","The journey across the high wire","Philippe Petit","19:08",1148,151064,"2012-05-23"
"k4N2SxUZwiU","https://www.youtube.com/watch?v=k4N2SxUZwiU","How I found a mythical boiling river in the Amazon | Andrés Ruzo","How I found a mythical boiling river in the Amazon","Andrés Ruzo","15:50",950,488715,"2016-02-24"
"k4vzhweOefs","https://www.youtube.com/watch?v=k4vzhweOefs","Ricardo Semler: Radical wisdom for a company, a school, a life","Radical wisdom for a company, a school, a life","Ricardo Semler","21:47",1307,457335,"2015-02-10"
"k5jEkTm5GIU","https://www.youtube.com/watch?v=k5jEkTm5GIU","Your Right to Mental Privacy in the Age of Brain-Sensing Tech | Nita Farahany | TED","Your Right to Mental Privacy in the Age of Brain-Sensing Tech","Nita Farahany","12:37",757,62172,"2023-05-30"
"k5tCYg9s0HU","https://www.youtube.com/watch?v=k5tCYg9s0HU","A letter to all who have lost in this era | Anand Giridharadas","A letter to all who have lost in this era","Anand Giridharadas","17:26",1046,99287,"2016-09-12"
"k6qTwqiHnAM","https://www.youtube.com/watch?v=k6qTwqiHnAM","Amos Winter: The cheap all-terrain wheelchair","The cheap all-terrain wheelchair","Amos Winter","11:15",675,497730,"2012-11-20"
"k7P9v9NB7fU","https://www.youtube.com/watch?v=k7P9v9NB7fU","How to Solve the World’s Biggest Problems | Natalie Cargill |  TED","How to Solve the World’s Biggest Problems","Natalie Cargill","17:00",1020,52573,"2023-09-18"
"k7i9uYruO3k","https://www.youtube.com/watch?v=k7i9uYruO3k","Why we must stop dancing to the sound of our own oppression | Madame Gandhi","Why we must stop dancing to the sound of our own oppression","Madame Gandhi","6:04",364,30357,"2020-09-09"
"k7sKMj85hDw","https://www.youtube.com/watch?v=k7sKMj85hDw","Why I'm a weekday vegetarian | Graham Hill","Why I'm a weekday vegetarian","Graham Hill","8:14",494,261458,"2010-05-18"
"k8OgHJ4WXR0","https://www.youtube.com/watch?v=k8OgHJ4WXR0","Sara Seager: The search for planets beyond our solar system","The search for planets beyond our solar system","Sara Seager","16:15",975,113434,"2015-05-28"
"k9dz4ydxmtM","https://www.youtube.com/watch?v=k9dz4ydxmtM","How long does it take to get over a breakup? | Am I Normal? with Mona Chalabi","How long does it take to get over a breakup?","Am I Normal? with Mona Chalabi","3:36",216,567907,"2021-10-19"
"kBBmVezBUkg","https://www.youtube.com/watch?v=kBBmVezBUkg","A mother and son's photographic journey through dementia | Tony Luciani","A mother and son's photographic journey through dementia","Tony Luciani","13:33",813,103881,"2019-02-04"
"kCudFI4tcpg","https://www.youtube.com/watch?v=kCudFI4tcpg","How AI Can Help You Turn an Idea Into the Next Great App | Amjad Masad | TED","How AI Can Help You Turn an Idea Into the Next Great App","Amjad Masad","10:08",608,92974,"2024-01-08"
"kEKzl6fub2w","https://www.youtube.com/watch?v=kEKzl6fub2w","Sally Kohn: Don’t like clickbait? Don’t click","Don’t like clickbait? Don’t click","Sally Kohn","4:41",281,150945,"2014-08-28"
"kFDaG9pAA1w","https://www.youtube.com/watch?v=kFDaG9pAA1w","How Clicking a Single Link Can Cost Millions | Ryan Pullen | TED","How Clicking a Single Link Can Cost Millions","Ryan Pullen","14:21",861,42071,"2024-02-29"
"kFMZrEABdw4","https://www.youtube.com/watch?v=kFMZrEABdw4","Bring on the learning revolution! | Ken Robinson","Bring on the learning revolution!","Ken Robinson","17:55",1075,719834,"2015-09-15"
"kIFOiF9Q4VM","https://www.youtube.com/watch?v=kIFOiF9Q4VM","Want to Get Ahead at Work? Risk the Awkward Moments | Henna Pryor | TED","Want to Get Ahead at Work? Risk the Awkward Moments","Henna Pryor","15:38",938,52244,"2024-09-05"
"kK_UjBmHqQw","https://www.youtube.com/watch?v=kK_UjBmHqQw","Magical houses, made of bamboo | Elora Hardy","Magical houses, made of bamboo","Elora Hardy","10:18",618,3300465,"2015-05-12"
"kLIfeGflNp8","https://www.youtube.com/watch?v=kLIfeGflNp8","Our refugee system is failing. Here's how we can fix it | Alexander Betts","Our refugee system is failing. Here's how we can fix it","Alexander Betts","18:10",1090,148428,"2016-03-24"
"kLmzxmRcUTo","https://www.youtube.com/watch?v=kLmzxmRcUTo","Peter Donnelly: How stats fool juries","How stats fool juries","Peter Donnelly","22:07",1327,245160,"2007-01-12"
"kMTCNOlozTA","https://www.youtube.com/watch?v=kMTCNOlozTA","Amory Lovins: We must win the oil endgame","We must win the oil endgame","Amory Lovins","19:39",1179,56810,"2008-01-09"
"kMUdrUP-QCs","https://www.youtube.com/watch?v=kMUdrUP-QCs","The Transformative Potential of AGI — and When It Might Arrive | Shane Legg and Chris Anderson | TED","The Transformative Potential of AGI — and When It Might Arrive","Shane Legg and Chris Anderson","16:12",972,209752,"2023-12-07"
"kQa11RMCeSI","https://www.youtube.com/watch?v=kQa11RMCeSI","Jack Horner: Shape-shifting dinosaurs","Shape-shifting dinosaurs","Jack Horner","18:24",1104,1671787,"2012-02-09"
"kSR8G8mfp84","https://www.youtube.com/watch?v=kSR8G8mfp84","A smart new business loan for people with no credit | Shivani Siroya","A smart new business loan for people with no credit","Shivani Siroya","8:12",492,176712,"2016-05-18"
"kSnvSXDN3Dk","https://www.youtube.com/watch?v=kSnvSXDN3Dk","The Luminous Mystery of Fireflies | Wan Faridah Akmal Jusoh | TED","The Luminous Mystery of Fireflies","Wan Faridah Akmal Jusoh","12:18",738,47217,"2024-05-21"
"kTqgiF4HmgQ","https://www.youtube.com/watch?v=kTqgiF4HmgQ","Rachel Botsman: The currency of the new economy is trust","The currency of the new economy is trust","Rachel Botsman","19:47",1187,153541,"2012-09-24"
"kU0ei9ApmsY","https://www.youtube.com/watch?v=kU0ei9ApmsY","Svante Pääbo: DNA clues to our inner neanderthal","DNA clues to our inner neanderthal","Svante Pääbo","17:02",1022,146731,"2011-08-30"
"kUwLGyd7ir4","https://www.youtube.com/watch?v=kUwLGyd7ir4","The economic benefits of climate action | Marcelo Mena","The economic benefits of climate action","Marcelo Mena","19:23",1163,29836,"2020-06-29"
"kWyQNCOow7A","https://www.youtube.com/watch?v=kWyQNCOow7A","What Makes a Job ""Good"" -- and the Case for Investing in People | Warren Valdmanis | TED","What Makes a Job ""Good"" -- and the Case for Investing in People","Warren Valdmanis","11:26",686,75013,"2022-02-28"
"kXGuWtR5ulg","https://www.youtube.com/watch?v=kXGuWtR5ulg","A campaign for period positivity | Ananya Grover","A campaign for period positivity","Ananya Grover","9:09",549,19033,"2020-04-15"
"kZP8Kqr_bcw","https://www.youtube.com/watch?v=kZP8Kqr_bcw","To eliminate waste, we need to rediscover thrift | Andrew Dent","To eliminate waste, we need to rediscover thrift","Andrew Dent","10:35",635,116727,"2018-04-26"
"kZeVIJqW1ts","https://www.youtube.com/watch?v=kZeVIJqW1ts","The Real-World Danger of Online Myths | Vidhya Ramalingam | TED","The Real-World Danger of Online Myths","Vidhya Ramalingam","14:12",852,38616,"2024-12-16"
"kZkQBmKf1qg","https://www.youtube.com/watch?v=kZkQBmKf1qg","Dawn Landes: A song for my hero, the woman who rowed into a hurricane","A song for my hero, the woman who rowed into a hurricane","Dawn Landes","9:27",567,87456,"2015-05-08"
"k_GFq12w5WU","https://www.youtube.com/watch?v=k_GFq12w5WU","Biomimicry in action | Janine Benyus","Biomimicry in action","Janine Benyus","20:15",1215,320638,"2009-08-06"
"k_Xr0oGW_h4","https://www.youtube.com/watch?v=k_Xr0oGW_h4","Why You Shouldn’t Trust Boredom | Kevin H. Gary | TED","Why You Shouldn’t Trust Boredom","Kevin H. Gary","10:56",656,93423,"2023-11-27"
"ka8L1YMR88U","https://www.youtube.com/watch?v=ka8L1YMR88U","Kathryn Schulz: Don't regret regret","Don't regret regret","Kathryn Schulz","16:52",1012,478604,"2011-12-02"
"kaU7IPlg9PA","https://www.youtube.com/watch?v=kaU7IPlg9PA","What a digital government looks like | Anna Piperal","What a digital government looks like","Anna Piperal","13:54",834,175946,"2020-01-28"
"kcEIsbO0ivA","https://www.youtube.com/watch?v=kcEIsbO0ivA","Fred Swaniker: The leaders who ruined Africa, and the generation who can fix it","The leaders who ruined Africa, and the generation who can fix it","Fred Swaniker","13:31",811,260509,"2014-10-21"
"kcwBH_Uevxo","https://www.youtube.com/watch?v=kcwBH_Uevxo","Nathan Myhrvold: Could this laser zap malaria?","Could this laser zap malaria?","Nathan Myhrvold","15:42",942,107625,"2010-05-11"
"kdAs3UVgIGg","https://www.youtube.com/watch?v=kdAs3UVgIGg","The next software revolution: programming biological cells | Sara-Jane Dunn","The next software revolution: programming biological cells","Sara-Jane Dunn","14:48",888,169978,"2019-11-26"
"kdqUhTnAgJU","https://www.youtube.com/watch?v=kdqUhTnAgJU","How the US government spies on people who protest -- including you | Jennifer Granick","How the US government spies on people who protest -- including you","Jennifer Granick","14:26",866,101875,"2017-09-14"
"khkJkR-ipfw","https://www.youtube.com/watch?v=khkJkR-ipfw","We don't ""move on"" from grief. We move forward with it | Nora McInerny | TED","We don't ""move on"" from grief. We move forward with it","Nora McInerny","15:06",906,1805084,"2019-04-25"
"kiUnJ1d8vvw","https://www.youtube.com/watch?v=kiUnJ1d8vvw","Jay Silver: Hack a banana, make a keyboard!","Hack a banana, make a keyboard!","Jay Silver","13:16",796,220609,"2013-05-16"
"kioUmpJQbKM","https://www.youtube.com/watch?v=kioUmpJQbKM","Climate Action Is on the Cusp of Exponential Growth | Simon Stiell | TED","Climate Action Is on the Cusp of Exponential Growth","Simon Stiell","7:53",473,46573,"2023-08-03"
"klBwPWL69P8","https://www.youtube.com/watch?v=klBwPWL69P8","Ken Goldberg: 4 lessons from robots about being human","4 lessons from robots about being human","Ken Goldberg","17:07",1027,14495,"2015-07-15"
"klXVQsbhFsE","https://www.youtube.com/watch?v=klXVQsbhFsE","How to foster true diversity and inclusion at work (and in your community) | Rosalind G. Brewer","How to foster true diversity and inclusion at work (and in your community)","Rosalind G. Brewer","23:02",1382,68972,"2020-12-23"
"klm0ghWoEhQ","https://www.youtube.com/watch?v=klm0ghWoEhQ","How vultures can help solve crimes | Lauren Pharr","How vultures can help solve crimes","Lauren Pharr","10:47",647,63855,"2018-06-22"
"klroP1mToFA","https://www.youtube.com/watch?v=klroP1mToFA","Stop being a bystander in your own life | Tracy Edwards","Stop being a bystander in your own life","Tracy Edwards","11:15",675,108644,"2020-07-22"
"kmIZeEu-3CY","https://www.youtube.com/watch?v=kmIZeEu-3CY","A lesson in turning adversaries into allies | Leah Garcés","A lesson in turning adversaries into allies","Leah Garcés","13:34",814,75384,"2020-10-01"
"kmNejqbx1M0","https://www.youtube.com/watch?v=kmNejqbx1M0","What productive conflict can offer a workplace | Jess Kutch","What productive conflict can offer a workplace","Jess Kutch","6:18",378,61907,"2019-11-22"
"kmbui1xF8DE","https://www.youtube.com/watch?v=kmbui1xF8DE","The intangible effects of walls | Alexandra Auer","The intangible effects of walls","Alexandra Auer","11:48",708,69768,"2020-04-30"
"kn-5H9p24oo","https://www.youtube.com/watch?v=kn-5H9p24oo","3 ways to uproot a culture of corruption | Wanjira Mathai","3 ways to uproot a culture of corruption","Wanjira Mathai","10:48",648,25145,"2020-03-26"
"kqItMybTKTo","https://www.youtube.com/watch?v=kqItMybTKTo","How to Do Laundry When You're Depressed | KC Davis | TED","How to Do Laundry When You're Depressed","KC Davis","12:58",778,90467,"2023-01-05"
"kqVGiB98cnc","https://www.youtube.com/watch?v=kqVGiB98cnc","A path to higher education and employment for refugees | Chrystina Russell","A path to higher education and employment for refugees","Chrystina Russell","5:45",345,40907,"2020-07-10"
"ktOeFgmdIAo","https://www.youtube.com/watch?v=ktOeFgmdIAo","How racism harms pregnant women -- and what can help | Miriam Zoila Pérez","How racism harms pregnant women -- and what can help","Miriam Zoila Pérez","12:26",746,74520,"2017-03-08"
"ktsuKyzihjU","https://www.youtube.com/watch?v=ktsuKyzihjU","How to Stop Banks from Investing in Fossil Fuels  | Lucie Pinson | TED","How to Stop Banks from Investing in Fossil Fuels ","Lucie Pinson","11:29",689,41322,"2022-05-31"
"ku1ht_ZAU-w","https://www.youtube.com/watch?v=ku1ht_ZAU-w","Enough Red Tape – We Need To Say Yes to Clean Energy | Rich Powell | TED","Enough Red Tape – We Need To Say Yes to Clean Energy","Rich Powell","11:44",704,35727,"2024-01-15"
"kuT7zWZEwl0","https://www.youtube.com/watch?v=kuT7zWZEwl0","A Parkland teacher's homework for us all | Diane Wolk-Rogers","A Parkland teacher's homework for us all","Diane Wolk-Rogers","15:47",947,67872,"2018-05-11"
"kv_uyUTx5Po","https://www.youtube.com/watch?v=kv_uyUTx5Po","Eric Berlow and Sean Gourley: Mapping ideas worth spreading","Mapping ideas worth spreading","Eric Berlow and Sean Gourley","7:56",476,71135,"2013-09-18"
"kvdHqS3ryw0","https://www.youtube.com/watch?v=kvdHqS3ryw0","How to get serious about diversity and inclusion in the workplace | Janet Stovall | TED","How to get serious about diversity and inclusion in the workplace","Janet Stovall","11:05",665,478873,"2018-09-13"
"kwYxHPXIaao","https://www.youtube.com/watch?v=kwYxHPXIaao","Rajesh Rao: Computing a Rosetta Stone for the Indus script","Computing a Rosetta Stone for the Indus script","Rajesh Rao","17:02",1022,1215407,"2011-06-28"
"kxGOuqsoteA","https://www.youtube.com/watch?v=kxGOuqsoteA","How to disrupt philanthropy in response to crisis | Darren Walker","How to disrupt philanthropy in response to crisis","Darren Walker","51:36",3096,32872,"2020-07-29"
"kyaiTGmwxnU","https://www.youtube.com/watch?v=kyaiTGmwxnU","How I'm Working for Change Inside My Church | Chelsea Shields | TED Talks","How I'm Working for Change Inside My Church","Chelsea Shields","12:37",757,79220,"2015-12-08"
"l--QYXCecew","https://www.youtube.com/watch?v=l--QYXCecew","You may be accidentally investing in cigarette companies | Bronwyn King","You may be accidentally investing in cigarette companies","Bronwyn King","14:39",879,90282,"2018-08-22"
"l13ezJ9rsAQ","https://www.youtube.com/watch?v=l13ezJ9rsAQ","Nathan Myhrvold: A life of fascinations","A life of fascinations","Nathan Myhrvold","18:47",1127,53609,"2008-06-04"
"l1fodZNF1GI","https://www.youtube.com/watch?v=l1fodZNF1GI","How to build a business that lasts 100 years | Martin Reeves","How to build a business that lasts 100 years","Martin Reeves","14:55",895,304767,"2016-09-01"
"l2_0V1DeDa4","https://www.youtube.com/watch?v=l2_0V1DeDa4","Carolyn Porco: Could a Saturn moon harbor life?","Could a Saturn moon harbor life?","Carolyn Porco","4:41",281,49202,"2009-05-21"
"l3uttHEZnTY","https://www.youtube.com/watch?v=l3uttHEZnTY","Claron McFadden: Singing the primal mystery","Singing the primal mystery","Claron McFadden","10:55",655,47486,"2011-03-28"
"l4Lq7gaKW4A","https://www.youtube.com/watch?v=l4Lq7gaKW4A","Lessons from My Father, Alexey Navalny | Dasha Navalnaya |  TED","Lessons from My Father, Alexey Navalny","Dasha Navalnaya","11:07",667,496118,"2023-10-13"
"l4gJCBK0Tfc","https://www.youtube.com/watch?v=l4gJCBK0Tfc","How to start a conversation about suicide | Jeremy Forbes","How to start a conversation about suicide","Jeremy Forbes","12:17",737,81473,"2018-06-14"
"l5ZJ6bK1EIc","https://www.youtube.com/watch?v=l5ZJ6bK1EIc","Iain Hutchison: Saving faces","Saving faces","Iain Hutchison","17:54",1074,29535,"2011-02-23"
"l5azMXvBfaw","https://www.youtube.com/watch?v=l5azMXvBfaw","The Secret Force for Limitless Energy? Lasers | Tammy Ma | TED","The Secret Force for Limitless Energy? Lasers","Tammy Ma","13:41",821,62427,"2024-08-01"
"l5vZHuAtDZA","https://www.youtube.com/watch?v=l5vZHuAtDZA","Krista Tippett: Reconnecting with compassion","Reconnecting with compassion","Krista Tippett","17:54",1074,60235,"2011-02-15"
"lA-zdh_bQBo","https://www.youtube.com/watch?v=lA-zdh_bQBo","Barry Schwartz: Our loss of wisdom","Our loss of wisdom","Barry Schwartz","20:46",1246,568607,"2009-02-16"
"lAzQWtkPzbI","https://www.youtube.com/watch?v=lAzQWtkPzbI","How we're harnessing nature's hidden superpowers | Oded Shoseyov","How we're harnessing nature's hidden superpowers","Oded Shoseyov","13:22",802,138718,"2016-10-18"
"lB3GWXStnzA","https://www.youtube.com/watch?v=lB3GWXStnzA","""Fight For You"" | Raye Zaragoza","""Fight For You""","Raye Zaragoza","3:27",207,50381,"2020-11-06"
"lDB_1iyJ1iQ","https://www.youtube.com/watch?v=lDB_1iyJ1iQ","Sex Education Should Start with Consent | Kaz | TED","Sex Education Should Start with Consent","Kaz","10:31",631,75417,"2022-03-10"
"lDq9-QxvsNU","https://www.youtube.com/watch?v=lDq9-QxvsNU","The art of choosing | Sheena Iyengar | TED","The art of choosing","Sheena Iyengar","27:18",1638,1000389,"2010-07-26"
"lEjegKJwI0M","https://www.youtube.com/watch?v=lEjegKJwI0M","How we experience time and memory through art | Sarah Sze","How we experience time and memory through art","Sarah Sze","13:52",832,75521,"2019-09-30"
"lFG1b1-EsW8","https://www.youtube.com/watch?v=lFG1b1-EsW8","Our dangerous obsession with perfectionism is getting worse | Thomas Curran","Our dangerous obsession with perfectionism is getting worse","Thomas Curran","14:55",895,248958,"2019-04-01"
"lGkh7-xOb3I","https://www.youtube.com/watch?v=lGkh7-xOb3I","Mental Health Care That Disrupts Cycles of Violence | Celina de Sola | TED","Mental Health Care That Disrupts Cycles of Violence","Celina de Sola","8:12",492,49302,"2022-05-05"
"lHXXsEtE3b4","https://www.youtube.com/watch?v=lHXXsEtE3b4","Philip Rosedale: Second Life, where anything is possible","Second Life, where anything is possible","Philip Rosedale","28:32",1712,32228,"2008-12-04"
"lJGtXuCmZBM","https://www.youtube.com/watch?v=lJGtXuCmZBM","Shilo Shiv Suleman: Using tech to enable dreaming","Using tech to enable dreaming","Shilo Shiv Suleman","7:37",457,52859,"2012-02-22"
"lKJEX-mrowo","https://www.youtube.com/watch?v=lKJEX-mrowo","Why Nurses Are Key to Medical Innovation | Ben Gran | TED","Why Nurses Are Key to Medical Innovation","Ben Gran","16:13",973,60680,"2023-01-20"
"lKp7_MtPXZM","https://www.youtube.com/watch?v=lKp7_MtPXZM","Can America Come Together after the Trump Assassination Attempt? | Ian Bremmer | TED","Can America Come Together after the Trump Assassination Attempt?","Ian Bremmer","36:29",2189,116333,"2024-07-15"
"lLBcszlV1xc","https://www.youtube.com/watch?v=lLBcszlV1xc","The Secret Somali Mixtapes | Far Flung with Saleem Reshamwala | TED Audio Collective","The Secret Somali Mixtapes","Far Flung with Saleem Reshamwala","28:50",1730,38492,"2022-08-02"
"lLGhrEHOjfs","https://www.youtube.com/watch?v=lLGhrEHOjfs","Robert Gupta and Joshua Roman duet on ""Passacaglia""","""Passacaglia""","Robert Gupta and Joshua Roman duet","9:22",562,134901,"2011-05-27"
"lMkHYE9-R0A","https://www.youtube.com/watch?v=lMkHYE9-R0A","Hod Lipson: Robots that are ""self-aware""","Robots that are ""self-aware""","Hod Lipson","8:15",495,117373,"2007-10-13"
"lO2A4g9tMJU","https://www.youtube.com/watch?v=lO2A4g9tMJU","How to Feng Shui Your Fridge — and Other Happy Climate Hacks | Jiaying Zhao | TED","How to Feng Shui Your Fridge — and Other Happy Climate Hacks","Jiaying Zhao","12:11",731,49231,"2023-04-22"
"lOEJOv-jeLY","https://www.youtube.com/watch?v=lOEJOv-jeLY","The Truth about Yeast in Your Body | Body Stuff with Dr. Jen Gunter | TED","The Truth about Yeast in Your Body","Body Stuff with Dr. Jen Gunter","3:08",188,101794,"2022-11-09"
