"video_id","url","video_title","speech_title","speaker_name","duration","duration_in_seconds","view_count","published_date"
"FrxDrpi1XNU","https://www.youtube.com/watch?v=FrxDrpi1XNU","Christopher Soghoian: Government surveillance — this is just the beginning","Government surveillance — this is just the beginning","Christopher Soghoian","8:19",499,131122,"2014-03-05"
"Ftow7dSpaiY","https://www.youtube.com/watch?v=Ftow7dSpaiY","Dame Stephanie Shirley: Why do ambitious women have flat heads?","Why do ambitious women have flat heads?","Dame Stephanie Shirley","13:44",824,177966,"2015-03-27"
"Fu1C-oBdsMM","https://www.youtube.com/watch?v=Fu1C-oBdsMM","Juan Enriquez: Your online life, permanent as a tattoo","Your online life, permanent as a tattoo","Juan Enriquez","5:58",358,288720,"2013-05-02"
"Fu1Zi1PYqos","https://www.youtube.com/watch?v=Fu1Zi1PYqos","What investigating neural pathways can reveal about mental health | Kay M. Tye","What investigating neural pathways can reveal about mental health","Kay M. Tye","13:00",780,83019,"2020-04-07"
"Fu_kBW_KSms","https://www.youtube.com/watch?v=Fu_kBW_KSms","Heather Knight: Silicon-based comedy","Silicon-based comedy","Heather Knight","9:14",554,96113,"2011-01-21"
"FvAl7Sjddok","https://www.youtube.com/watch?v=FvAl7Sjddok","Nora York: Singing ""What I Want""","Singing ""What I Want""","Nora York","4:31",271,10125,"2015-07-17"
"FvchLmGiXfY","https://www.youtube.com/watch?v=FvchLmGiXfY","Could an Orca Give a TED Talk? | Karen Bakker | TED","Could an Orca Give a TED Talk?","Karen Bakker","13:48",828,118000,"2023-07-18"
"FwFkb1x7FJQ","https://www.youtube.com/watch?v=FwFkb1x7FJQ","Amy Smith: Simple designs that could save millions of childrens' lives","Simple designs that could save millions of childrens' lives","Amy Smith","15:46",946,41639,"2007-01-16"
"FzhI2D_kaCY","https://www.youtube.com/watch?v=FzhI2D_kaCY","A Path to Social Safety for Migrant Workers | Ashif Shaikh | TED","A Path to Social Safety for Migrant Workers","Ashif Shaikh","8:01",481,30823,"2024-03-15"
"G2XBIkHW954","https://www.youtube.com/watch?v=G2XBIkHW954","The linguistic genius of babies | Patricia Kuhl","The linguistic genius of babies","Patricia Kuhl","13:28",808,886448,"2011-02-18"
"G2Y6Am46eVU","https://www.youtube.com/watch?v=G2Y6Am46eVU","Bruce Feiler: The council of dads","The council of dads","Bruce Feiler","20:34",1234,32359,"2011-01-28"
"G37VO1yeVEo","https://www.youtube.com/watch?v=G37VO1yeVEo","Time Traveling with AI to Connect with Lost Loved Ones | Amy Kurzweil | TED","Time Traveling with AI to Connect with Lost Loved Ones","Amy Kurzweil","9:20",560,46280,"2024-09-25"
"G5UT0K_NEig","https://www.youtube.com/watch?v=G5UT0K_NEig","My Mission to Change the Narrative of Mental Health | Glenn Close | TED","My Mission to Change the Narrative of Mental Health","Glenn Close","12:13",733,50230,"2023-12-20"
"G6CVj5IQkzk","https://www.youtube.com/watch?v=G6CVj5IQkzk","Jeff Hawkins: How brain science will change computing","How brain science will change computing","Jeff Hawkins","22:10",1330,208315,"2007-05-23"
"G7VxEqJp3NQ","https://www.youtube.com/watch?v=G7VxEqJp3NQ","The 100 Tampons NASA (Almost) Sent To Space -- and Other Absurd Songs | Marcia Belsky | TED","The 100 Tampons NASA (Almost) Sent To Space -- and Other Absurd Songs","Marcia Belsky","13:02",782,71668,"2022-05-13"
"G83MDe_-QNc","https://www.youtube.com/watch?v=G83MDe_-QNc","How carbon capture networks could help curb climate change | Bas Sudmeijer","How carbon capture networks could help curb climate change","Bas Sudmeijer","11:06",666,55118,"2021-01-29"
"G88JZ1DIdg8","https://www.youtube.com/watch?v=G88JZ1DIdg8","How urban agriculture is transforming Detroit | Devita Davison","How urban agriculture is transforming Detroit","Devita Davison","12:23",743,102651,"2018-01-09"
"G8RxjxdUulE","https://www.youtube.com/watch?v=G8RxjxdUulE","How we'll fight the next deadly virus | Pardis Sabeti","How we'll fight the next deadly virus","Pardis Sabeti","9:38",578,87252,"2016-02-25"
"G8gJJuCdP_A","https://www.youtube.com/watch?v=G8gJJuCdP_A","Why gun violence can't be our new normal | Dan Gross","Why gun violence can't be our new normal","Dan Gross","13:39",819,106668,"2016-04-20"
"G8yKFVPOD6o","https://www.youtube.com/watch?v=G8yKFVPOD6o","William Kamkwamba: How I built a windmill","How I built a windmill","William Kamkwamba","6:10",370,1282499,"2007-08-01"
"G9-urSR19SI","https://www.youtube.com/watch?v=G9-urSR19SI","How to teach kids to talk about taboo topics | Liz Kleinrock","How to teach kids to talk about taboo topics","Liz Kleinrock","12:02",722,146295,"2019-03-15"
"G9UEBLcJIRc","https://www.youtube.com/watch?v=G9UEBLcJIRc","The Counterintuitive Psychology of Insurance | Orit Tykocinski | TED","The Counterintuitive Psychology of Insurance","Orit Tykocinski","16:13",973,50209,"2022-03-21"
"GAMR5RD_LJo","https://www.youtube.com/watch?v=GAMR5RD_LJo","Barton Seaver: Sustainable seafood? Let's get smart","Sustainable seafood? Let's get smart","Barton Seaver","9:57",597,26141,"2010-10-27"
"GB4s5b9NL3I","https://www.youtube.com/watch?v=GB4s5b9NL3I","Capitalism will eat democracy -- unless we speak up | Yanis Varoufakis","Capitalism will eat democracy -- unless we speak up","Yanis Varoufakis","19:52",1192,1272200,"2016-02-15"
"GB6fO0Tylvs","https://www.youtube.com/watch?v=GB6fO0Tylvs","Dan Pacholke: How prisons can help inmates live meaningful lives","How prisons can help inmates live meaningful lives","Dan Pacholke","10:37",637,75100,"2014-08-13"
"GFpciGYBELo","https://www.youtube.com/watch?v=GFpciGYBELo","Why sleep matters now more than ever | Matt Walker","Why sleep matters now more than ever","Matt Walker","1:00:42",3642,140329,"2020-04-03"
"GGScU5ESei4","https://www.youtube.com/watch?v=GGScU5ESei4","Richard Sears: Planning for the end of oil","Planning for the end of oil","Richard Sears","7:23",443,52525,"2010-05-20"
"GIBoCJeB3HQ","https://www.youtube.com/watch?v=GIBoCJeB3HQ","How women in Pakistan are creating political change | Shad Begum","How women in Pakistan are creating political change","Shad Begum","13:56",836,65506,"2019-03-08"
"GIbz9ms9Z9k","https://www.youtube.com/watch?v=GIbz9ms9Z9k","Ivan Oransky: Are we over-medicalized?","Are we over-medicalized?","Ivan Oransky","10:25",625,53990,"2012-06-19"
"GIrfNWed1Mk","https://www.youtube.com/watch?v=GIrfNWed1Mk","A bold plan to empower 1.6 million out-of-school girls in India | Safeena Husain","A bold plan to empower 1.6 million out-of-school girls in India","Safeena Husain","10:00",600,96185,"2019-10-28"
"GMynksvCcUI","https://www.youtube.com/watch?v=GMynksvCcUI","Jennifer Granholm: A clean energy proposal -- race to the top!","A clean energy proposal -- race to the top!","Jennifer Granholm","12:42",762,62735,"2013-02-28"
"GOCUH7TxHRI","https://www.youtube.com/watch?v=GOCUH7TxHRI","How we read each other's minds | Rebecca Saxe","How we read each other's minds","Rebecca Saxe","16:52",1012,562969,"2009-09-11"
"GOW0IKO_zfM","https://www.youtube.com/watch?v=GOW0IKO_zfM","Ian Dunbar: Dog-friendly dog training","Dog-friendly dog training","Ian Dunbar","14:47",887,261766,"2008-08-21"
"GPz2hDvjkX4","https://www.youtube.com/watch?v=GPz2hDvjkX4","An Interdimensional Performance of Imagination | Particle Ink | TED","An Interdimensional Performance of Imagination","Particle Ink","4:16",256,44651,"2022-07-04"
"GQDQ9rUx-6g","https://www.youtube.com/watch?v=GQDQ9rUx-6g","Jay Walker: A library of human imagination","A library of human imagination","Jay Walker","8:24",504,47762,"2008-12-16"
"GRKIRE45JO0","https://www.youtube.com/watch?v=GRKIRE45JO0","Can the Metaverse Bring Us Closer to Wildlife? | Gautam Shah | TED","Can the Metaverse Bring Us Closer to Wildlife?","Gautam Shah","5:48",348,47148,"2023-01-04"
"GROCkg810R0","https://www.youtube.com/watch?v=GROCkg810R0","Emma Teeling: The secret of the bat genome","The secret of the bat genome","Emma Teeling","16:23",983,6479,"2015-07-15"
"GRfudKFLAmI","https://www.youtube.com/watch?v=GRfudKFLAmI","The genius behind some of the world's most famous buildings | Renzo Piano","The genius behind some of the world's most famous buildings","Renzo Piano","15:04",904,879156,"2018-07-13"
"GRgqbsP_-uw","https://www.youtube.com/watch?v=GRgqbsP_-uw","Why Do You Love Your Favorite Songs? | Scarlet Keys | TED","Why Do You Love Your Favorite Songs?","Scarlet Keys","19:12",1152,56856,"2024-12-03"
"GSf6nij-SdA","https://www.youtube.com/watch?v=GSf6nij-SdA","How online abuse of women has spiraled out of control | Ashley Judd","How online abuse of women has spiraled out of control","Ashley Judd","16:11",971,327981,"2017-01-18"
"GTmQF2ABid0","https://www.youtube.com/watch?v=GTmQF2ABid0","Why Violence Is Rising With Global Temperatures | Peter Schwartzstein | TED","Why Violence Is Rising With Global Temperatures","Peter Schwartzstein","4:19",259,31824,"2025-01-08"
"GVdzOw_8pFE","https://www.youtube.com/watch?v=GVdzOw_8pFE","What Does Poverty Look Like on a Plate? | Huiyi Lin | TED","What Does Poverty Look Like on a Plate?","Huiyi Lin","4:17",257,42380,"2025-01-03"
"GX9woZi0HUY","https://www.youtube.com/watch?v=GX9woZi0HUY","How teachers can help students navigate trauma | Lisa Godwin","How teachers can help students navigate trauma","Lisa Godwin","15:21",921,93898,"2020-03-03"
"GZGY0wPAnus","https://www.youtube.com/watch?v=GZGY0wPAnus","The art of misdirection | Apollo Robbins | TED","The art of misdirection","Apollo Robbins","8:48",528,27729210,"2013-09-13"
"GZadCj8O1-0","https://www.youtube.com/watch?v=GZadCj8O1-0","The $8 billion iPod | Rob Reid","The $8 billion iPod","Rob Reid","5:12",312,950937,"2012-03-15"
"G_0UMcx7YlM","https://www.youtube.com/watch?v=G_0UMcx7YlM","A new way to ""grow"" islands and coastlines | Skylar Tibbits","A new way to ""grow"" islands and coastlines","Skylar Tibbits","7:28",448,74478,"2020-05-21"
"GcJxRqTs5nk","https://www.youtube.com/watch?v=GcJxRqTs5nk","Moral behavior in animals | Frans de Waal","Moral behavior in animals","Frans de Waal","16:53",1013,1947138,"2012-04-10"
"Gdi7uN-DQYo","https://www.youtube.com/watch?v=Gdi7uN-DQYo","A New National Park to Reclaim Indigenous Land | Tracie Revis | TED","A New National Park to Reclaim Indigenous Land","Tracie Revis","7:03",423,26556,"2024-04-10"
"GfF2e0vyGM4","https://www.youtube.com/watch?v=GfF2e0vyGM4","The strongest predictor for success | Angela Lee Duckworth","The strongest predictor for success","Angela Lee Duckworth","3:09",189,632603,"2021-04-30"
"Gg5M3J_FHXY","https://www.youtube.com/watch?v=Gg5M3J_FHXY","Simple hacks for life with Parkinson's | Mileha Soneji","Simple hacks for life with Parkinson's","Mileha Soneji","6:58",418,167242,"2016-03-31"
"GhpFTQfiqCs","https://www.youtube.com/watch?v=GhpFTQfiqCs","Roberto D'Angelo + Francesca Fedeli: In our baby's illness, a life lesson","In our baby's illness, a life lesson","Roberto D'Angelo + Francesca Fedeli","6:18",378,122343,"2013-07-24"
"GigYWy2UmOY","https://www.youtube.com/watch?v=GigYWy2UmOY","Brain magic | Keith Barry","Brain magic","Keith Barry","19:50",1190,10691770,"2008-07-21"
"Gj8IA6xOpSk","https://www.youtube.com/watch?v=Gj8IA6xOpSk","The call to learn | Clifford Stoll","The call to learn","Clifford Stoll","17:51",1071,1289936,"2008-03-27"
"GlUS6KE67Vs","https://www.youtube.com/watch?v=GlUS6KE67Vs","Melinda French Gates: What nonprofits can learn from Coca-Cola","What nonprofits can learn from Coca-Cola","Melinda French Gates","17:00",1020,320162,"2010-10-12"
"Gmai4zkKNcM","https://www.youtube.com/watch?v=Gmai4zkKNcM","The state of the climate -- and what we might do about it | Nicholas Stern","The state of the climate -- and what we might do about it","Nicholas Stern","16:38",998,86024,"2014-09-22"
"Gn2W3X_pGh4","https://www.youtube.com/watch?v=Gn2W3X_pGh4","One year of turning the world inside out | JR","One year of turning the world inside out","JR","6:32",392,199951,"2012-05-18"
"GpxV10eD538","https://www.youtube.com/watch?v=GpxV10eD538","Africa is a sleeping giant -- I'm trying to wake it up | Adeola Fayehun","Africa is a sleeping giant -- I'm trying to wake it up","Adeola Fayehun","7:10",430,133535,"2020-07-27"
"GqGksNRYu8s","https://www.youtube.com/watch?v=GqGksNRYu8s","We've stopped trusting institutions and started trusting strangers | Rachel Botsman","We've stopped trusting institutions and started trusting strangers","Rachel Botsman","17:09",1029,204345,"2016-11-07"
"GqnJFm1C-3c","https://www.youtube.com/watch?v=GqnJFm1C-3c","Jamil Abu-Wardeh: The Axis of Evil Middle East Comedy Tour","The Axis of Evil Middle East Comedy Tour","Jamil Abu-Wardeh","9:15",555,462501,"2010-08-19"
"Gv7Y0W0xmYQ","https://www.youtube.com/watch?v=Gv7Y0W0xmYQ","Malte Spitz: Your phone company is watching","Your phone company is watching","Malte Spitz","9:57",597,141725,"2012-07-24"
"GvGAIGbnX7E","https://www.youtube.com/watch?v=GvGAIGbnX7E","Steven Schwaitzberg: A universal translator for surgeons","A universal translator for surgeons","Steven Schwaitzberg","11:42",702,22648,"2013-01-24"
"GzOQLDwUAC8","https://www.youtube.com/watch?v=GzOQLDwUAC8","Powerful visual illusions | Al Seckel","Powerful visual illusions","Al Seckel","16:31",991,108323,"2007-04-30"
"H-vvS1zonI0","https://www.youtube.com/watch?v=H-vvS1zonI0","The Bias behind Your Undiagnosed Chronic Pain | Sheetal DeCaria | TED","The Bias behind Your Undiagnosed Chronic Pain","Sheetal DeCaria","12:51",771,55379,"2022-09-20"
"H03o2WCBoDU","https://www.youtube.com/watch?v=H03o2WCBoDU","The real reason manufacturing jobs are disappearing | Augie Picado","The real reason manufacturing jobs are disappearing","Augie Picado","12:06",726,158490,"2017-09-28"
"H0_yKBitO8M","https://www.youtube.com/watch?v=H0_yKBitO8M","Build a tower, build a team | Tom Wujec","Build a tower, build a team","Tom Wujec","7:23",443,2515065,"2010-04-22"
"H14bBuluwB8","https://www.youtube.com/watch?v=H14bBuluwB8","Grit: The Power of Passion and Perseverance | Angela Lee Duckworth | TED","Grit: The Power of Passion and Perseverance","Angela Lee Duckworth","6:13",373,15621399,"2013-05-09"
"H2QxFM9y0tY","https://www.youtube.com/watch?v=H2QxFM9y0tY","The disarming case to act right now on climate change | Greta Thunberg","The disarming case to act right now on climate change","Greta Thunberg","11:13",673,2319964,"2019-02-13"
"H3TF-hI7zKc","https://www.youtube.com/watch?v=H3TF-hI7zKc","How sampling transformed music | Mark Ronson","How sampling transformed music","Mark Ronson","16:55",1015,3541957,"2014-05-09"
"H3ddtbeduoo","https://www.youtube.com/watch?v=H3ddtbeduoo","Christopher Emdin: Teach teachers how to create magic","Teach teachers how to create magic","Christopher Emdin","6:55",415,422757,"2014-04-08"
"H4iRPytrnJo","https://www.youtube.com/watch?v=H4iRPytrnJo","Don Levy: A cinematic journey through visual effects","A cinematic journey through visual effects","Don Levy","6:55",415,78049,"2013-01-04"
"H682jmofwZs","https://www.youtube.com/watch?v=H682jmofwZs","Reed Kroloff: Architecture, modern and romantic","Architecture, modern and romantic","Reed Kroloff","15:22",922,16440,"2008-07-28"
"H6DnmEFrIos","https://www.youtube.com/watch?v=H6DnmEFrIos","The Truth About Faking Orgasms | Karen Gurney | TED","The Truth About Faking Orgasms","Karen Gurney","11:39",699,62426,"2022-11-21"
"H6MVJm9ElMA","https://www.youtube.com/watch?v=H6MVJm9ElMA","How AI and Democracy Can Fix Each Other | Divya Siddarth | TED","How AI and Democracy Can Fix Each Other","Divya Siddarth","11:02",662,30806,"2024-03-05"
"H6kBP9b3I90","https://www.youtube.com/watch?v=H6kBP9b3I90","Jacqueline Novogratz: Tackling poverty with ""patient capita","Tackling poverty with ""patient capita","Jacqueline Novogratz","20:21",1221,27571,"2007-08-14"
"H8kr_V3fEGA","https://www.youtube.com/watch?v=H8kr_V3fEGA","Let’s Reframe Cancel Culture | Sarah Jones | TED","Let’s Reframe Cancel Culture","Sarah Jones","14:28",868,49668,"2023-10-23"
"H9ZOpQzjukY","https://www.youtube.com/watch?v=H9ZOpQzjukY","A glimpse of the future through an augmented reality headset | Meron Gribetz","A glimpse of the future through an augmented reality headset","Meron Gribetz","10:55",655,376457,"2016-04-11"
"HA7GwKXfJB0","https://www.youtube.com/watch?v=HA7GwKXfJB0","Sebastian Seung: I am my connectome","I am my connectome","Sebastian Seung","22:35",1355,251543,"2010-09-28"
"HANo__Z8K6s","https://www.youtube.com/watch?v=HANo__Z8K6s","CRISPR's Next Advance Is Bigger Than You Think | Jennifer Doudna | TED","CRISPR's Next Advance Is Bigger Than You Think","Jennifer Doudna","7:37",457,848136,"2023-09-27"
"HBbBs1ohZtI","https://www.youtube.com/watch?v=HBbBs1ohZtI","A Safe Pathway to Resettlement for Migrants and Refugees | Becca Heller | TED","A Safe Pathway to Resettlement for Migrants and Refugees","Becca Heller","11:14",674,34321,"2022-05-02"
"HCgv_HNoJrY","https://www.youtube.com/watch?v=HCgv_HNoJrY","Humble plants that hide surprising secrets | Ameenah Gurib-Fakim:","Humble plants that hide surprising secrets","Ameenah Gurib-Fakim:","14:17",857,71813,"2014-11-04"
"HD4bpztESWw","https://www.youtube.com/watch?v=HD4bpztESWw","John Hardy: My green school dream","My green school dream","John Hardy","15:36",936,110162,"2010-11-22"
"HDHbjYNBwXI","https://www.youtube.com/watch?v=HDHbjYNBwXI","Poetry and Music That Reaches Across the Digital Void | Elle Cordova | TED","Poetry and Music That Reaches Across the Digital Void","Elle Cordova","6:59",419,162008,"2024-10-31"
"HDjM5lw8OYo","https://www.youtube.com/watch?v=HDjM5lw8OYo","How to see past your own perspective and find truth | Michael Patrick Lynch","How to see past your own perspective and find truth","Michael Patrick Lynch","14:27",867,221538,"2017-07-10"
"HEkmWdapz4c","https://www.youtube.com/watch?v=HEkmWdapz4c","Unions for Climate Action! | Payton M. Wilkins | TED","Unions for Climate Action!","Payton M. Wilkins","9:13",553,26531,"2023-10-18"
"HF9G9M0cR0E","https://www.youtube.com/watch?v=HF9G9M0cR0E","Woody Norris: Hypersonic sound and other inventions","Hypersonic sound and other inventions","Woody Norris","15:17",917,227202,"2009-01-27"
"HFKmpyf9ucQ","https://www.youtube.com/watch?v=HFKmpyf9ucQ","How to Lead in the New Era of Employee Activism | Megan Reitz | TED","How to Lead in the New Era of Employee Activism","Megan Reitz","16:11",971,42636,"2022-09-29"
"HHwXlcHcTHc","https://www.youtube.com/watch?v=HHwXlcHcTHc","Stuart Brown: Play is more than fun","Play is more than fun","Stuart Brown","26:43",1603,404336,"2009-03-12"
"HI7zfpitZpo","https://www.youtube.com/watch?v=HI7zfpitZpo","Kailash Satyarthi: How to make peace? Get angry","How to make peace? Get angry","Kailash Satyarthi","18:34",1114,220185,"2015-04-13"
"HJtbtEn0-uk","https://www.youtube.com/watch?v=HJtbtEn0-uk","The Case for a New Great Migration in the US | Charles M. Blow | TED","The Case for a New Great Migration in the US","Charles M. Blow","13:18",798,37503,"2023-11-28"
"HLEgiR1Fsds","https://www.youtube.com/watch?v=HLEgiR1Fsds","The biology of gender, from DNA to the brain | Karissa Sanbonmatsu","The biology of gender, from DNA to the brain","Karissa Sanbonmatsu","12:53",773,350431,"2019-02-11"
"HLuv7lsvWco","https://www.youtube.com/watch?v=HLuv7lsvWco","Peter Gabriel: Fighting injustice with a videocamera","Fighting injustice with a videocamera","Peter Gabriel","14:52",892,38618,"2007-01-12"
"HLwvyD1MbSM","https://www.youtube.com/watch?v=HLwvyD1MbSM","A Menu of Foods We Might Lose Forever | Sam Kass | TED","A Menu of Foods We Might Lose Forever","Sam Kass","11:51",711,53173,"2024-11-20"
"HMYVH-hBGWg","https://www.youtube.com/watch?v=HMYVH-hBGWg","Ray Kurzweil: A university for the coming singularity","A university for the coming singularity","Ray Kurzweil","8:42",522,87539,"2009-06-02"
"HNMQ_w7hXTA","https://www.youtube.com/watch?v=HNMQ_w7hXTA","The surprisingly charming science of your gut | Giulia Enders","The surprisingly charming science of your gut","Giulia Enders","14:04",844,1069403,"2017-11-24"
"HNOnvp5t7Do","https://www.youtube.com/watch?v=HNOnvp5t7Do","Julian Assange: Why the world needs WikiLeaks","Why the world needs WikiLeaks","Julian Assange","19:34",1174,736329,"2010-07-19"
"HQzXqjT0w3k","https://www.youtube.com/watch?v=HQzXqjT0w3k","Miguel Nicolelis: Brain-to-brain communication has arrived. How we did it","Brain-to-brain communication has arrived. How we did it","Miguel Nicolelis","19:02",1142,160488,"2015-01-26"
"HR9956gDpUY","https://www.youtube.com/watch?v=HR9956gDpUY","A plan to recycle the unrecyclable | Ashton Cofer","A plan to recycle the unrecyclable","Ashton Cofer","6:02",362,160650,"2017-04-18"
"HSdXqmnNCp0","https://www.youtube.com/watch?v=HSdXqmnNCp0","Adam Grosser: A mobile fridge for vaccines","A mobile fridge for vaccines","Adam Grosser","3:32",212,82981,"2008-06-24"
"HSercnrqeN4","https://www.youtube.com/watch?v=HSercnrqeN4","A hilarious celebration of lifelong female friendship | Jane Fonda and Lily Tomlin","A hilarious celebration of lifelong female friendship","Jane Fonda and Lily Tomlin","15:45",945,2086115,"2016-01-19"
"HSgQHH2YBxw","https://www.youtube.com/watch?v=HSgQHH2YBxw","Does Your Heartbeat Shape Your Sense of Time? | Irena Arslanova | TED","Does Your Heartbeat Shape Your Sense of Time?","Irena Arslanova","9:26",566,90915,"2025-01-22"
"HTdY_3wyKMs","https://www.youtube.com/watch?v=HTdY_3wyKMs","Allison Hunt: How I got my new hip","How I got my new hip","Allison Hunt","6:46",406,17289,"2007-07-26"
"HUM2rCIUdeI","https://www.youtube.com/watch?v=HUM2rCIUdeI","Kevin Bales: How to combat modern slavery","How to combat modern slavery","Kevin Bales","20:34",1234,159667,"2010-03-29"
"HW2SSoYteIs","https://www.youtube.com/watch?v=HW2SSoYteIs","Technology that knows what you're feeling | Poppy Crum","Technology that knows what you're feeling","Poppy Crum","12:43",763,138146,"2018-07-10"
"HWj54Wt7uY4","https://www.youtube.com/watch?v=HWj54Wt7uY4","Meet Methane, the Invisible Climate Villain | Marcelo Mena | TED","Meet Methane, the Invisible Climate Villain","Marcelo Mena","9:22",562,29595,"2023-11-27"
"HWsehvUkI-c","https://www.youtube.com/watch?v=HWsehvUkI-c","Max Little: A test for Parkinson's with a phone call","A test for Parkinson's with a phone call","Max Little","6:05",365,115315,"2012-08-07"
"HXbsVbFAczg","https://www.youtube.com/watch?v=HXbsVbFAczg","How to build a company where the best ideas win | Ray Dalio","How to build a company where the best ideas win","Ray Dalio","16:34",994,1404987,"2017-09-06"
"HY71088saG4","https://www.youtube.com/watch?v=HY71088saG4","How young people join violent extremist groups -- and how to stop them | Erin Marie Saltman","How young people join violent extremist groups -- and how to stop them","Erin Marie Saltman","11:39",699,171160,"2017-09-18"
"HYkMo0hi-Yw","https://www.youtube.com/watch?v=HYkMo0hi-Yw","Life Is Hard. Art Helps | Liana Finck | TED","Life Is Hard. Art Helps","Liana Finck","7:38",458,95356,"2024-01-03"
"HYnZy2Cx7UM","https://www.youtube.com/watch?v=HYnZy2Cx7UM","How Testosterone and Culture Shape Behavior | Carole K. Hooven | TED","How Testosterone and Culture Shape Behavior","Carole K. Hooven","14:36",876,57017,"2024-09-02"
"HYzrdn7YLCM","https://www.youtube.com/watch?v=HYzrdn7YLCM","Lessons from death row inmates | David R. Dow","Lessons from death row inmates","David R. Dow","18:17",1097,2777978,"2012-06-18"
"HZCeqs-fR60","https://www.youtube.com/watch?v=HZCeqs-fR60","Graham Hawkes: Fly the seas on a submarine with wings","Fly the seas on a submarine with wings","Graham Hawkes","13:38",818,132344,"2008-11-04"
"H_8y0WLm78U","https://www.youtube.com/watch?v=H_8y0WLm78U","The price of shame | Monica Lewinsky | TED","The price of shame","Monica Lewinsky","22:31",1351,14083807,"2015-03-21"
"H_pqhMO3ZSY","https://www.youtube.com/watch?v=H_pqhMO3ZSY","What will a future without secrets look like? | Alessandro Acquisti","What will a future without secrets look like?","Alessandro Acquisti","15:01",901,202791,"2013-10-18"
"H_rsxmtfKr0","https://www.youtube.com/watch?v=H_rsxmtfKr0","How Great Leaders Innovate Responsibly | Ken Chenault | TED","How Great Leaders Innovate Responsibly","Ken Chenault","12:21",741,68567,"2022-06-20"
"HaHeAdJNa70","https://www.youtube.com/watch?v=HaHeAdJNa70","Nathan Wolfe: What's left to explore?","What's left to explore?","Nathan Wolfe","7:11",431,45521,"2012-05-21"
"HbQZ7jAvgoI","https://www.youtube.com/watch?v=HbQZ7jAvgoI","How to talk (and listen) to transgender people | Jackson Bird","How to talk (and listen) to transgender people","Jackson Bird","6:25",385,329351,"2017-12-05"
"HbUeAdVXOVc","https://www.youtube.com/watch?v=HbUeAdVXOVc","Erica Frenkel: The universal anesthesia machine","The universal anesthesia machine","Erica Frenkel","11:24",684,59240,"2012-02-02"
"Hc6yi_FtoNo","https://www.youtube.com/watch?v=Hc6yi_FtoNo","The walk from ""no"" to ""yes"" | William Ury","The walk from ""no"" to ""yes""","William Ury","19:16",1156,731179,"2010-12-01"
"HdwOlk6HIVc","https://www.youtube.com/watch?v=HdwOlk6HIVc","Why we need the explorers | Brian Cox","Why we need the explorers","Brian Cox","17:00",1020,454138,"2010-06-03"
"HfMhU6qjVVM","https://www.youtube.com/watch?v=HfMhU6qjVVM","New nanotech to detect cancer early | Joshua Smith","New nanotech to detect cancer early","Joshua Smith","12:27",747,88515,"2017-03-01"
"Hfejyq5nrvE","https://www.youtube.com/watch?v=Hfejyq5nrvE","The Intersection of War and Climate Change | Victor Ochen | TED","The Intersection of War and Climate Change","Victor Ochen","11:27",687,20272,"2024-08-30"
"Hg9STIrY0No","https://www.youtube.com/watch?v=Hg9STIrY0No","A dance to honor Mother Earth | Jon Boogz and Lil Buck","A dance to honor Mother Earth","Jon Boogz and Lil Buck","9:36",576,66225,"2017-08-24"
"Hh09xlzxRmE","https://www.youtube.com/watch?v=Hh09xlzxRmE","My year reading a book from every country in the world | Ann Morgan","My year reading a book from every country in the world","Ann Morgan","12:04",724,195103,"2015-12-21"
